channel	sender	content	attachment
dm:mike:jamie	jamie	Next up: teaching you about pour-over
dm:sarah:alex	sarah	Thanks for volunteering to mentor the new intern next month
dm:sarah:alex	alex	Of course! Love helping new devs grow
dm:sarah:alex	sarah	Your webhook demo was really engaging
dm:sarah:alex	alex	Thanks! Been working on my presentation skills
general	sarah	Don't forget to submit your conference talk proposals! Deadline next week
general	mike	Just submitted mine on scaling distributed systems
general	alex	Going for "Tales from the Redis Trenches" 
general	jamie	"Coffee-Driven Development" - think they'll accept it? 😄
general	sarah	Honestly? Probably! 😄
general	mike	Team building next month: Escape room vs Laser tag - thoughts?
general	alex	Escape room! Let's put our problem-solving to the test
general	jamie	+1 for escape room
general	pat	Either sounds fun!
general	sarah	Escape room it is! Booking it for next Friday
general	mike	Anyone up for board games after work Thursday?
general	jamie	I'll bring Settlers of Catan!
general	alex	No more Catan! You always win 😅
general	sarah	How about that new co-op game instead?
general	jamie	Fine, but I'm still bringing my coffee
general	sarah	Great retro everyone! Love how we're keeping things blameless
general	mike	The action items are super clear this time
general	alex	Those new retro tools are working well
general	jamie	Yeah, much better than the spreadsheet days
general	pat	The anonymous feedback feature is really helpful
general	sarah	Agreed! Psychological safety for the win 🎉
dm:sarah:jamie	sarah	Your mentoring style is really positive
dm:sarah:jamie	jamie	Thanks! I try to remember how overwhelming things felt at first
dm:sarah:jamie	sarah	The team really values your approach
dm:sarah:jamie	jamie	That means a lot. I just want everyone to succeed
general	sarah	🎉 Celebrating 6 months without a prod incident!
general	mike	Remember the great cache invalidation incident?
general	alex	We don't talk about cache invalidation... 😅
general	jamie	At least we got a great post-mortem template out of it
general	mike	And a new team motto: "Cache is hard, let's go shopping"
general	sarah	Still better than the Redis failover of 2023 😂 
engineering	sarah	Team, our conference budget for Q2 is approved! Who's interested in speaking?
engineering	mike	I can share our multi-region scaling journey
engineering	alex	Thinking about a deep dive on distributed locking patterns
engineering	jamie	Maybe something on observability best practices?
engineering	sarah	Love these ideas. Let's do a proposal workshop next week
engineering	mike	I can help review everyone's abstracts
engineering	alex	Found a great systems design workshop next month
engineering	jamie	Oh nice! Is that the one by that Redis core team member?
engineering	alex	Yeah! They're covering exactly what we need for sharding
engineering	mike	Company can sponsor 3 tickets - who wants to join?
dm:sarah:alex	sarah	Your last tech talk was fantastic. Ready for bigger conferences?
dm:sarah:alex	alex	Thanks! Been studying some conference recordings
dm:sarah:alex	sarah	I can intro you to some program committees
dm:sarah:alex	alex	That would be amazing. Really want to level up my speaking
dm:mike:jamie	mike	How's the SRE certification prep going?
dm:mike:jamie	jamie	Good! Just finished the chaos engineering module
dm:mike:jamie	mike	Perfect timing with our multi-region work
dm:mike:jamie	jamie	Yeah, planning to use it for my case study
general	sarah	New learning stipend approved! $2500/person for courses and certs
general	mike	Perfect timing - there's a great distributed systems course at MIT
general	alex	Anyone interested in group-studying for the AWS Solutions Architect?
general	jamie	Count me in! Been meaning to level up my cloud skills
general	pat	I'd like to join too if that's okay
general	alex	Of course! Study sessions every Wednesday?
engineering	mike	Starting a new book club - "Designing Data-Intensive Applications"
engineering	alex	Great choice! Chapter 1 discussion next week?
engineering	jamie	I've got my copy ready. Those consistency models are wild
engineering	pat	I'll grab a copy today
engineering	mike	Perfect! We'll focus on real-world examples from our stack
dm:sarah:mike	sarah	How's the team's professional development tracking?
dm:sarah:mike	mike	Good progress. Alex is ready for conference speaking
dm:sarah:mike	sarah	And Jamie's SRE transition?
dm:sarah:mike	mike	Going well. The cert prep is really helping
dm:mike:alex	mike	Want to lead next month's architecture review?
dm:mike:alex	alex	Definitely! Been studying other companies' tech blogs
dm:mike:alex	mike	Great prep. Maybe turn it into a conference talk after?
dm:mike:alex	alex	That's the plan. Building a portfolio of tech content
engineering	sarah	New internal tech talks series starting next month!
engineering	mike	I'll kick it off with distributed systems patterns
engineering	alex	Can I do one on our Redis architecture evolution?
engineering	jamie	+1 for sharing our observability journey
engineering	sarah	Love it! Let's make it bi-weekly
engineering	mike	Great way to practice for conference talks too
dm:sarah:jamie	sarah	Heard you're interested in the SRE track
dm:sarah:jamie	jamie	Yes! The oncall rotations got me interested
dm:sarah:jamie	sarah	We can adjust your role to focus more on that
dm:sarah:jamie	jamie	That would be perfect. Love the infrastructure side
general	mike	Anyone using learning platforms? Need recommendations
general	alex	Frontend Masters is great for TypeScript deep dives
general	jamie	I like Coursera for distributed systems stuff
general	sarah	We just got a team license for O'Reilly's platform
general	mike	Perfect! Their system design videos are excellent
engineering	sarah	Reminder: Career development plans due next week
engineering	mike	Added my goals around systems architecture
engineering	alex	Focusing on public speaking and technical writing
engineering	jamie	SRE transition and chaos engineering certification
engineering	pat	I'll focus on TypeScript and testing patterns
engineering	sarah	Great goals everyone! Let's review in our 1:1s
dm:mike:jamie	mike	Your infrastructure designs are really solid
dm:mike:jamie	jamie	Thanks! Been studying Google's SRE books
dm:mike:jamie	mike	Ready to lead the next infrastructure project?
dm:mike:jamie	jamie	Absolutely! Been waiting for this opportunity
general	sarah	Exciting news! We're hosting a local tech meetup next month
general	mike	Perfect! We can share our scaling journey
general	alex	I can demo the new observability dashboard
general	jamie	Should we do a workshop portion too?
general	sarah	Great idea! Maybe a distributed systems lab?
general	mike	I'll help design the hands-on exercises 