channel	sender	content	attachment
leadership	sarah	Mike, we need to discuss Pat's recent performance. I'm concerned about their output.
leadership	mike	I've noticed too. The last three sprints have been below expectations.
leadership	sarah	What steps have you taken to address this?
leadership	mike	I've had two 1:1s about delivery timelines, but haven't seen improvement.
leadership	sarah	Let's monitor for another sprint, but we may need to make a tough decision.
leadership	mike	Agreed. I'll document everything carefully and we can reassess in two weeks.
leadership	sarah	Perfect. Let's keep this between us for now.
leadership	mike	Sarah, I've compiled Pat's performance metrics from the last quarter
leadership	mike	PR completion rate is 43% compared to team average of 87%
leadership	mike	Average time to complete tickets: Pat - 8.2 days, Team average - 3.5 days
leadership	sarah	Those are concerning numbers. How about code quality metrics?
leadership	mike	Static analysis shows 2.3x more lint errors than team average
leadership	mike	And 68% of PRs require multiple rounds of revision
leadership	sarah	Have you discussed these specific metrics with Pat?
leadership	mike	Yes, in our last 1:1. They seemed overwhelmed by the data
leadership	mike	Pat mentioned struggling with our codebase complexity
leadership	sarah	What support have we provided for that?
leadership	mike	Paired them with Jamie for knowledge transfer, set up architecture review sessions
leadership	mike	Also reduced their ticket complexity for this sprint
leadership	sarah	Good steps. Timeline for improvement?
leadership	mike	I've set 30-day goals: PR completion rate to 65%, time per ticket under 5 days
leadership	sarah	And if those aren't met?
leadership	mike	Then we'll need to discuss performance improvement plan or role fit
leadership	sarah	Agreed. Keep me updated weekly on the metrics
leadership	mike	Week 1 update: PR rate still at 51%, but code quality is improving
leadership	sarah	That's something. How's the team dynamic?
leadership	mike	Tense. Alex is frustrated about blocked dependencies
leadership	mike	Jamie's been great helping, but it's impacting their velocity too
leadership	sarah	We can't let this affect the whole team
leadership	mike	I know. I'm drafting a performance improvement plan now
leadership	sarah	Good. We need to make a decision by end of month
engineering	mike	Team, please update your sprint tickets by EOD.
engineering	alex	All my tickets are updated and on track.
engineering	jamie	Same here, just finished the API integration.
engineering	pat	I'm still working through the customer import feature. Taking longer than expected.
engineering	alex	Pat, that was supposed to be done last week... 🤔
engineering	pat	I know, sorry. The edge cases are more complex than I thought.
engineering	mike	Let's pair up tomorrow to get it finished.
engineering	jamie	I've already implemented similar logic in the export feature, might be worth looking at that.
engineering	pat	Thanks, I'll take a look.
engineering	alex	We really need to stick to our sprint commitments...
engineering	pat	Getting a lot of edge cases in PR #234. The import validation is tricky
engineering	alex	Those edge cases were covered in the spec, Pat
engineering	pat	Must have missed them, looking now
engineering	jamie	I can help review the spec with you if you want
engineering	pat	Thanks Jamie, that would help
engineering	alex	@mike this is blocking the export feature integration
engineering	mike	Let's have a team sync on this at 2pm
engineering	pat	I'll have an update ready by then
engineering	alex	This is the third time this ticket has blocked us
engineering	jamie	Let's focus on solutions. I can pair with Pat after the sync
engineering	mike	Team, new sprint starts tomorrow. Let's review velocity targets
engineering	alex	My components are ready for the custom fields feature
engineering	jamie	Rate limiting implementation is ahead of schedule
engineering	pat	Still working through the import bugs...
engineering	alex	@mike Can we reassign some of Pat's tickets? We're falling behind
engineering	mike	Let's discuss in tomorrow's planning meeting
engineering	pat	I can get it done, just need a bit more time
engineering	jamie	I can take the export feature integration part
engineering	alex	We're already two weeks behind on that
engineering	mike	Approved Jamie's offer. Pat, focus on fixing the current bugs
product	sarah	Exciting update: We just signed BigCorp as a beta customer! 🎉
product	mike	Great news! Team, we need to prioritize their requested features.
product	alex	I can take point on the custom fields implementation.
product	jamie	I'll handle the API rate limiting work.
product	pat	I can work on the bulk import feature.
product	alex	Pat, are you sure? You're still finishing up the customer import...
product	pat	Yes, I can handle both.
product	mike	Let's focus on finishing current tasks first.
product	sarah	Agreed, quality over quantity. One thing at a time.
product	jamie	I can help with the bulk import if needed.
product	sarah	BigCorp needs the import feature by end of month
product	mike	We'll get it done. Making some team adjustments
product	pat	I'll work through the weekend if needed
product	mike	No, let's stick to sustainable pace. Jamie will help
product	alex	I can review the final PR this week
dm:sarah:mike	sarah	Have you documented all the performance issues with Pat?
dm:sarah:mike	mike	Yes, I have a detailed doc with missed deadlines and quality issues.
dm:sarah:mike	sarah	Good. Let's discuss next steps tomorrow.
dm:sarah:mike	mike	Performance improvement plan is ready for review
dm:sarah:mike	sarah	Send it over. We need to act before BigCorp integration
dm:sarah:mike	mike	The team's velocity is suffering too much
dm:sarah:alex	sarah	Hey Alex, how's the custom fields implementation going?
dm:sarah:alex	alex	Making good progress, should have a PR ready by tomorrow.
dm:sarah:alex	sarah	Perfect, let me know if you need any product specs clarified.
dm:sarah:alex	alex	Sarah, can we talk about the team velocity issues?
dm:sarah:alex	sarah	What's on your mind?
dm:sarah:alex	alex	Pat's delays are affecting everyone's work
dm:sarah:jamie	sarah	Jamie, great work on the API rate limiting!
dm:sarah:jamie	jamie	Thanks! Been fun working on the infrastructure side.
dm:sarah:jamie	sarah	Would you be interested in taking on more DevOps tasks?
dm:sarah:jamie	sarah	Thanks for helping Pat. How's it really going?
dm:sarah:jamie	jamie	They're trying hard, but struggling with fundamentals
dm:sarah:jamie	sarah	Keep me posted on any progress
dm:sarah:pat	sarah	Pat, do you have a moment to discuss your current tasks?
dm:sarah:pat	pat	Yes, I know I'm behind but I'm catching up.
dm:sarah:pat	sarah	Let's have a proper 1:1 tomorrow to review everything.
dm:sarah:pat	sarah	Pat, I appreciate your willingness to work weekends
dm:sarah:pat	pat	I know I need to improve, I'm trying my best
dm:sarah:pat	sarah	Let's focus on sustainable improvements instead
dm:mike:alex	mike	Can you review Pat's PR when you get a chance?
dm:mike:alex	alex	Sure, but last time it needed a lot of work...
dm:mike:alex	mike	I know, but we need to help them improve.
dm:mike:alex	alex	Mike, we need to talk about team velocity
dm:mike:alex	mike	I know. Working on a solution
dm:mike:alex	alex	The BigCorp deadline is at risk
dm:mike:jamie	mike	Your export feature implementation is really clean
dm:mike:jamie	jamie	Thanks! Happy to pair with Pat on the import feature.
dm:mike:jamie	mike	That would be great, maybe tomorrow afternoon?
dm:mike:jamie	mike	How's the pairing with Pat going?
dm:mike:jamie	jamie	Some progress, but basic patterns are still challenging
dm:mike:jamie	mike	Document what you can. Might need it for the PIP
dm:mike:pat	mike	How are you feeling about the sprint goals?
dm:mike:pat	pat	Honestly, struggling a bit with the complexity.
dm:mike:pat	mike	Let's break it down together in our 1:1.
dm:mike:pat	mike	I've reviewed your progress on the 30-day goals we discussed
dm:mike:pat	pat	I know I'm still not hitting the targets
dm:mike:pat	mike	Your PR completion rate is at 51% - better, but still below our 65% goal
dm:mike:pat	pat	The complexity of the validation logic is slowing me down
dm:mike:pat	mike	Let's pair more frequently - how's 3x week sound?
dm:mike:pat	pat	Yes please, that would really help
dm:mike:pat	mike	Pat, we need to have a serious discussion tomorrow
dm:mike:pat	pat	Is this about the import feature delays?
dm:mike:pat	mike	About overall performance and next steps
dm:alex:jamie	alex	Want to grab coffee and brainstorm the API design?
dm:alex:jamie	jamie	Yes! I have some ideas about the rate limiting.
dm:alex:jamie	alex	Perfect, see you at 3?
dm:alex:jamie	alex	Thanks for taking on the export integration
dm:alex:jamie	jamie	No problem, we need to hit that BigCorp deadline
dm:alex:jamie	alex	This can't keep happening though
dm:alex:pat	alex	I left some comments on your PR
dm:alex:pat	pat	Thanks, I'll address them today
dm:alex:pat	alex	Let me know if anything is unclear
dm:alex:pat	alex	Pat, these are the same issues as the last PR
dm:alex:pat	pat	Sorry, still getting used to the patterns
dm:alex:pat	alex	You should check the style guide I shared last week
dm:alex:pat	alex	The validation logic needs to be completely refactored
dm:alex:pat	pat	I thought I followed the patterns this time
dm:alex:pat	alex	Let's review it together one last time
dm:jamie:pat	jamie	Hey, I can help with the import feature if you want
dm:jamie:pat	pat	That would be really helpful, thanks Jamie
dm:jamie:pat	jamie	No problem, we all need help sometimes
dm:jamie:pat	jamie	I've been looking at your validation code - want to review it together?
dm:jamie:pat	pat	Yes please, especially the edge cases part
dm:jamie:pat	jamie	Cool, I've dealt with similar issues in the export service
dm:jamie:pat	jamie	Want to grab lunch and debug the validation issues?
dm:jamie:pat	pat	Thanks Jamie, you've been really helpful through all this
dm:jamie:pat	jamie	Of course. Everyone learns at different paces 
engineering	mike	Team, I've got the BigCorp technical requirements doc. Let's break this down.	/data/uploads/bigcorp-integration-spec.pdf
engineering	alex	Just reviewed it. Their data volume is significant - 500k records per import
engineering	jamie	We'll need to handle that asynchronously. Queue-based architecture?
engineering	alex	Agreed. I'm thinking AWS SQS with Lambda for processing
engineering	mike	Good call. Let's draft the API endpoints they'll need
engineering	alex	POST /api/v1/imports/bulk - Initiates import, returns job ID
engineering	alex	GET /api/v1/imports/:jobId - Status and progress
engineering	jamie	We should add validation endpoints too
engineering	jamie	POST /api/v1/imports/validate - Pre-flight check of the data
engineering	alex	Rate limiting requirements: 1000 req/min for bulk endpoints
engineering	jamie	That's high. We'll need Redis for rate limiting
engineering	mike	Security requirements are strict - all endpoints need HMAC auth
engineering	alex	And data encryption at rest. I'll update the API spec
engineering	jamie	We should version the import format for future compatibility
engineering	alex	Good point. I'll add content-type: application/vnd.bigcorp.v1+json
engineering	mike	Let's document the custom field constraints too
engineering	jamie	Max 50 custom fields, 256 chars per field name, 1024 per value
engineering	alex	I'll add validation for those limits in the schema
product	sarah	BigCorp's CTO wants to discuss the technical architecture	/data/uploads/bigcorp-requirements.pdf
product	mike	I'll prepare the system design doc for review	/data/uploads/architecture-decision-record.pdf
product	alex	I've added performance benchmarks to the doc
product	sarah	Perfect. They're particularly interested in data security
product	mike	We'll walk them through the encryption and auth flows
product	jamie	I've documented our rate limiting approach too
product	sarah	They're asking about concurrent import support
product	mike	We'll support up to 5 concurrent bulk imports per customer
product	alex	With real-time progress tracking via WebSocket
dm:sarah:mike	sarah	How are we looking on BigCorp's security requirements?
dm:sarah:mike	mike	Good. HMAC auth designed, encryption planned
dm:sarah:mike	sarah	Their CISO will be in tomorrow's call
dm:sarah:mike	mike	Perfect timing, our security doc is ready
dm:mike:alex	mike	Can you review the rate limiting design?
dm:mike:alex	alex	Looking at it now. Redis cluster should handle their volume
dm:mike:alex	mike	What about the failover scenario?
dm:mike:alex	alex	We'll need a secondary Redis cluster in another AZ
dm:mike:jamie	mike	How's the import API spec coming along?
dm:mike:jamie	jamie	Done. Added OpenAPI docs with all endpoints
dm:mike:jamie	mike	Great. Can you share it with BigCorp's team?
dm:mike:jamie	jamie	Sure. I'll walk them through the validation flows
dm:alex:jamie	alex	Check out the rate limiting PR when you can
dm:alex:jamie	jamie	Will do. We should load test it first
dm:alex:jamie	alex	I've set up k6 for that. Want to review the test scenarios?
dm:alex:jamie	jamie	Perfect. Let's simulate their peak load 
leadership	mike	Code review stats: Pat's PRs average 4.8 revisions vs team average of 1.9
leadership	sarah	That's concerning. What about test coverage?
leadership	mike	Unit test coverage dropped from 82% to 76% in modules Pat owns
leadership	sarah	And integration tests?
leadership	mike	Several E2E tests failing due to edge cases being missed
leadership	sarah	What's the impact on our reliability metrics?
leadership	mike	Production incidents up 15% this quarter, mostly from the import service
leadership	sarah	Document these metrics for our next review
engineering	pat	Getting TypeScript errors in the validation module. Anyone seen this before?
engineering	alex	It's in the type definitions I shared last week
engineering	jamie	I can walk you through the generic constraints
engineering	pat	Thanks, the discriminated unions are confusing me
engineering	alex	@mike This is blocking the schema validation release
engineering	mike	Pat, let's pair on this after standup
engineering	pat	Found a race condition in the bulk import queue
engineering	jamie	That's why we use the distributed lock pattern
engineering	alex	We covered this in the architecture review...
engineering	pat	The Redis cluster config is different from docs
engineering	jamie	I'll help you set up your local environment
engineering	alex	@mike These are basic patterns we use everywhere
dm:mike:jamie	mike	How's Pat doing with the TypeScript training?
dm:mike:jamie	jamie	Struggling with generics and utility types
dm:mike:jamie	mike	Any improvement from last week?
dm:mike:jamie	jamie	Small progress, but still missing core concepts
dm:mike:pat	mike	I noticed you're not using the debug tools we discussed
dm:mike:pat	pat	They're complicated with the TypeScript setup
dm:mike:pat	mike	That's making your debugging much slower
dm:mike:pat	pat	I'll try to use them more consistently
dm:alex:jamie	alex	Pat's latest PR has the same validation bugs again
dm:alex:jamie	jamie	I know, I'm trying to help with code examples
dm:alex:jamie	alex	We can't keep fixing the same issues
dm:sarah:mike	mike	I've updated Pat's performance metrics dashboard
dm:sarah:mike	sarah	What's the trend on code quality?
dm:sarah:mike	mike	Static analysis shows increasing technical debt
dm:sarah:mike	sarah	And the impact on team velocity?
dm:sarah:mike	mike	Team spending 30% more time on PR reviews
engineering	mike	Team, I'm setting up automated PR quality checks
engineering	alex	Good, should help catch common issues earlier
engineering	jamie	I'll add some TypeScript-specific linting rules
engineering	pat	Will this flag my current PR issues?
engineering	mike	Yes, it'll help identify patterns to improve
engineering	alex	These are the same rules we've been using manually
dm:sarah:jamie	sarah	How's the mentoring with Pat progressing?
dm:sarah:jamie	jamie	Some concepts aren't sticking, even after repeated sessions
dm:sarah:jamie	sarah	Are they asking questions during your sessions?
dm:sarah:jamie	jamie	Yes, but often about things we covered previously
dm:alex:pat	alex	Your PR is missing error handling again
dm:alex:pat	pat	I thought the try/catch was enough
dm:alex:pat	alex	We need proper error types and logging
dm:alex:pat	pat	Can you show me an example?
dm:jamie:pat	jamie	I added comments to your validation PR
dm:jamie:pat	pat	Thanks, the type inference part is tricky
dm:jamie:pat	jamie	Let's review it together tomorrow
dm:jamie:pat	pat	I appreciate your patience with all this 
product	sarah	Team, BigCorp's feedback on the beta is in - they love the performance!
product	mike	Great to hear. Their import volume is 2x what we expected
product	alex	The queue-based architecture is handling it well
product	jamie	Redis cluster hasn't gone above 60% capacity
product	sarah	They want to expand the pilot to 3 more departments
product	mike	That'll push us to about 2M records per day
product	alex	We should look at sharding the processing queues
product	jamie	I'll draft a scaling proposal
engineering	alex	Pushed changes to handle BigCorp's custom field requirements
engineering	jamie	Nice! The validation looks solid
engineering	mike	They're asking about webhook support for import events
engineering	alex	We can use our event bus architecture
engineering	jamie	I'll add retry logic with exponential backoff
engineering	mike	Good call. They'll need delivery guarantees
engineering	alex	Adding signed webhooks for security
engineering	jamie	Max retries = 5, max delay = 1 hour?
engineering	alex	Perfect. I'll update the docs
leadership	sarah	BigCorp's expanding faster than expected
leadership	mike	The architecture is scaling well so far
leadership	sarah	What about the custom fields feature?
leadership	mike	Alex's implementation is solid. No performance impact
leadership	sarah	Perfect. They mentioned wanting early access to the API
leadership	mike	We can create a separate staging environment
dm:sarah:mike	sarah	BigCorp's CTO loved the technical deep dive
dm:sarah:mike	mike	Great! The event system demo went smoothly
dm:sarah:mike	sarah	They want to discuss enterprise features
dm:sarah:mike	mike	I'll prepare a technical roadmap
engineering	mike	New requirement: BigCorp needs audit logs for all imports
engineering	alex	We can extend the event system to handle that
engineering	jamie	I'll add structured logging with trace IDs
engineering	alex	Should we use OpenTelemetry?
engineering	mike	Yes, they'll want to pipe logs to their SIEM
engineering	jamie	I'll set up the exporters
product	sarah	BigCorp security team needs a technical review
product	mike	I'll schedule it for next week
product	alex	I've documented our encryption standards
product	jamie	Added details about our SOC 2 controls
product	sarah	They specifically asked about data retention
product	mike	We'll walk them through the lifecycle policies
dm:mike:alex	mike	How's the custom field performance testing?
dm:mike:alex	alex	Good. Indexed queries still sub-10ms at 1M records
dm:mike:alex	mike	Perfect. BigCorp will be happy
dm:mike:alex	alex	Should we add materialized views?
dm:alex:jamie	alex	The webhook retry system is ready for review
dm:alex:jamie	jamie	Looking now. Did you add dead letter queues?
dm:alex:jamie	alex	Yes, with Slack notifications for failures
dm:alex:jamie	jamie	Perfect. I'll test failure scenarios
engineering	mike	Team, let's review BigCorp's Q2 feature requests
engineering	alex	They want bulk export with the same throughput?
engineering	jamie	The queue architecture can handle it
engineering	mike	Good. What about their SSO requirement?
engineering	alex	We can support SAML via WorkOS
engineering	jamie	I'll add role mapping support
engineering	mike	They need custom roles for their teams
engineering	alex	The RBAC system can handle it
product	sarah	BigCorp's rolling out to their entire org next month
product	mike	Infrastructure is ready. Load tests look good
product	alex	Monitoring dashboards are set up
product	jamie	Alert thresholds configured for their volume
product	sarah	What's our scaling headroom?
product	mike	We can handle 5x their projected volume
leadership	sarah	BigCorp's becoming our reference customer
leadership	mike	The technical implementation is solid
leadership	sarah	Their CTO is speaking at our conference
leadership	mike	Perfect timing with the enterprise launch 
engineering	mike	BigCorp found an edge case in concurrent imports
engineering	alex	Looks like a race condition in the cleanup job
engineering	jamie	The distributed lock isn't being released properly
engineering	alex	Adding Redlock for better distributed locking
engineering	mike	Good catch. What about the deadlock scenario?
engineering	jamie	I'll add lock timeouts and circuit breakers
engineering	alex	Should we increase the lock TTL?
engineering	jamie	Yes, and add jitter to prevent thundering herd
product	sarah	BigCorp wants to integrate their internal monitoring
product	mike	They use DataDog. We'll need custom metrics
product	alex	I can expose our Prometheus endpoints
product	jamie	Adding custom dashboards for their SRE team
product	sarah	They need p95 latency under 200ms
product	mike	Current p95 is 180ms, we have headroom
engineering	mike	New BigCorp requirement: data residency per region
engineering	alex	We'll need to shard the Redis clusters by region
engineering	jamie	And replicate the queues across regions
engineering	alex	What about cross-region consistency?
engineering	mike	Eventually consistent is fine for their use case
engineering	jamie	I'll document the replication delays
leadership	sarah	BigCorp's enterprise launch is our top priority
leadership	mike	Infrastructure is ready for multi-region
leadership	sarah	What about the compliance requirements?
leadership	mike	SOC 2 Type 2 audit starts next week
leadership	sarah	Perfect. And the enterprise features?
leadership	mike	All done: SSO, audit logs, RBAC, data residency
dm:sarah:mike	sarah	BigCorp's board wants a technical review
dm:sarah:mike	mike	I've prepared the architecture diagrams
dm:sarah:mike	sarah	Focus on the high availability setup
dm:sarah:mike	mike	Got it. Multi-region with active-active setup
engineering	alex	Pushed multi-region support for webhooks
engineering	jamie	Nice! Using regional endpoints with failover?
engineering	alex	Yeah, with DNS-based routing per region
engineering	mike	What's the failover time looking like?
engineering	alex	Sub-30 seconds with automated health checks
engineering	jamie	I'll add synthetic monitoring per region
product	sarah	BigCorp needs guaranteed throughput SLAs
product	mike	We can commit to 99.9% at 2000 reqs/min
product	alex	Current capacity is 3x that with autoscaling
product	jamie	I've set up SLO monitoring in DataDog
product	sarah	They also want monthly availability reports
product	mike	We'll automate those with our metrics pipeline
dm:mike:alex	mike	How's the regional sharding coming along?
dm:mike:alex	alex	Good. Each region is completely isolated
dm:mike:alex	mike	Perfect. What about the migration plan?
dm:mike:alex	alex	Zero-downtime with shadow traffic testing
dm:alex:jamie	alex	Regional queue setup is ready for testing
dm:alex:jamie	jamie	Starting load tests now. 1M records per region
dm:alex:jamie	alex	Monitor for any cross-region latency spikes
dm:alex:jamie	jamie	Got it. Running 24-hour soak test first
engineering	mike	Team, final BigCorp enterprise launch checklist
engineering	alex	Multi-region deployment paths verified
engineering	jamie	Failover scenarios all tested successfully
engineering	alex	Monitoring alerts properly routing to their PagerDuty
engineering	mike	Perfect. When can we start the migration?
engineering	jamie	Data migration scripts are ready for Monday
leadership	sarah	BigCorp's CTO signed off on the technical review
leadership	mike	Great news. All their requirements are met
leadership	sarah	This will be a major reference architecture
leadership	mike	Already documenting it for future enterprise clients 
general	sarah	Morning team! Don't forget our virtual coffee chat at 11am ☕️
general	jamie	I'll bring my new coffee roast to show off 😄
general	alex	Another coffee snob in the making...
general	mike	Better than my instant coffee I guess 😅
general	sarah	Reminder: Team lunch tomorrow to celebrate our 1M users milestone! 🎉
general	mike	Can't believe how far we've come in 18 months
general	alex	Remember when we had that Redis instance on Mike's laptop? 😂
general	jamie	Dark days... but hey, we shipped!
general	pat	Looking forward to it! Where are we ordering from?
general	sarah	Thinking that new ramen place everyone's been talking about
general	mike	Oh yes! Their spicy miso is amazing
general	jamie	+1 for ramen!
general	sarah	Quick shoutout to Jamie for that clutch debug session yesterday! 🚀
general	jamie	Just doing my part! Those race conditions were tricky
general	alex	The fix was so elegant too. Really nice work!
general	mike	This is why we do those architecture reviews 💡
general	sarah	Team, we're starting a new Friday tradition: Demo & Donuts! 🍩
general	alex	Dibs on presenting the new webhook system next week
general	jamie	I'll bring the donuts! Any requests?
general	mike	Anything but plain glazed please 😄
general	sarah	Congrats on the successful deploy team! Time for virtual drinks? 🎉
general	mike	I've got my victory coffee ready ☕️
general	alex	Coffee at 5pm? You're wild Mike
general	jamie	Tea gang reporting in 🫖
general	pat	I'll grab my hot chocolate!
general	sarah	Whatever works! Here's to zero deployment issues 🎉
dm:alex:jamie	alex	That new ramen place for lunch tomorrow?
dm:alex:jamie	jamie	You read my mind! 12:30?
dm:alex:jamie	alex	Perfect. Mike mentioned the spicy miso
dm:alex:jamie	jamie	I'm still recovering from last time 😅
dm:mike:jamie	mike	Your coffee recommendations changed my life
dm:mike:jamie	jamie	Finally gave up on the instant? 😄
dm:mike:jamie	mike	The team's productivity thanks you
